sentence,pub_year,news_link,outlet
"British Prime Minster Rishi Sunak said it was ""completely reasonable"" for his government to examine transgender reforms passed in Scotland on Thursday given concerns raised by campaigners about the impact on women's safety.",2022,https://www.reuters.com/world/europe/uks-sunak-concerns-about-scotlands-gender-reforms-should-be-examined-2022-12-23/,Reuters
"England's 1966 World Cup-winning right-back George Cohen has died aged 83, his former club Fulham announced on Friday.",2022,https://www.reuters.com/lifestyle/sports/england-1966-world-cup-winner-cohen-dies-aged-83-2022-12-23/,Reuters
"Slovakia's President Zuzana Caputova removed Finance Minister Igor Matovic from his government post on Friday and put Prime Minister Eduard Heger in charge of the ministry, a presidential spokesperson said.",2022,https://www.reuters.com/world/europe/slovak-president-removes-finance-minister-part-budget-deal-2022-12-23/,Reuters
"The U.S. House of Representatives on Friday is due to vote on a <a href=""https://appropriations.house.gov/sites/democrats.appropriations.house.gov/files/FY23%20Summary%20of%20Appropriations%20Provisions.pdf"" target=""_blank"">$1.66 trillion bill</a> that provid…",2022,https://www.reuters.com/world/us/us-house-vote-166-trillion-funding-bill-shutdown-deadline-nears-2022-12-23/,Reuters
"A suicide car bombing at a checkpoint in Pakistan's capital of Islamabad on Friday killed one police official and injured several others, police said.",2022,https://www.reuters.com/world/asia-pacific/four-police-wounded-car-explosion-islamabad-checkpoint-police-2022-12-23/,Reuters
"Trevor Bauer's suspension for violating Major League Baseball's (MLB) domestic violence and sexual assault policy has been cut by a neutral arbitrator, clearing the way for the Los Angeles Dodgers pitcher's immediate reinstatement.",2022,https://www.reuters.com/lifestyle/sports/bauers-suspension-cut-clearing-path-return-2022-12-23/,Reuters
Football Australia said on Friday it has barred Melbourne Victory from selling tickets for their home matches until mid-January in the wake of a violent pitch invasion during the abandoned Melbourne derby.,2022,https://www.reuters.com/lifestyle/sports/melbourne-victory-barred-selling-tickets-after-pitch-invasion-football-australia-2022-12-23/,Reuters
"Jaccob Slavin finished off a tic-tac-toe play for a goal 23 seconds into overtime Thursday to give the visiting Carolina Hurricanes their seventh straight win, 4-3 over the Pittsburgh Penguins.",2022,https://www.reuters.com/lifestyle/sports/nhl-roundup-hurricanes-tie-team-record-with-13-game-point-streak-2022-12-23/,Reuters
"The dollar was on the front foot on Friday, as solid U.S. economic data reinforced the need for the Federal Reserve to stay on its aggressive monetary policy tightening path and further raised the odds of higher-for-longer rates.",2022,https://www.reuters.com/markets/currencies/dollar-solidly-bid-fed-view-economic-resilience-yen-eyes-weekly-gain-2022-12-23/,Reuters
"Billionaire Michael Bloomberg, the owner of Bloomberg L.P., is interested in acquiring either Wall Street Journal parent Dow Jones or the Washington Post, news website Axios <a href=""https://www.axios.com/2022/12/23/bloomberg-wsj-dow-jones-washington-post"" ta…",2022,https://www.reuters.com/business/media-telecom/media-mogul-michael-bloomberg-looking-buy-dow-jones-or-washington-post-axios-2022-12-23/,Reuters
"Withdrawing cash to pay for wine at Zagreb's Christmas Market is no easy task as the country readies to introduce the euro on Jan. 1, including preparing ATM cash machines by leaving only a third of them able to dispense the national kuna currency.",2022,https://www.reuters.com/markets/currencies/dwindling-numbers-cash-machines-dispense-kunas-croatia-readies-euro-2022-12-23/,Reuters
"The Biden administration on Friday said it was ordering Mastercard Inc <a href=""https://www.reuters.com/companies/MA.N"" target=""_blank"">(MA.N)</a> to stop blocking the use of competing networks to process debit payments.",2022,https://www.reuters.com/business/finance/us-orders-mastercard-stop-blocking-competing-payment-networks-2022-12-23/,Reuters
"The year's worst from Kim Strassel, Kyle Peterson, Mary O'Grady, Dan Henninger and Paul Gigot.",2022,https://www.foxnews.com/video/6317694568112,Fox News
"Big issues, big decisions on abortion, religious liberty, government power.",2022,https://www.foxnews.com/video/6317692988112,Fox News
Markets swooned as the Fed fought inflation.,2022,https://www.foxnews.com/video/6317694770112,Fox News
An election standoff means the battles will resume.,2022,https://www.foxnews.com/video/6317694774112,Fox News
"The year's best from Kim Strassel, Kyle Peterson, Mary O'Grady, Dan Henninger and Paul Gigot.",2022,https://www.foxnews.com/video/6317694779112,Fox News
The $1.7 trillion spending package passed by both chambers of Congress includes more funding for a controversial case management program for illegal immigrants.,2022,https://www.foxnews.com/politics/omnibus-spending-package-ups-funding-dhs-pilot-program-aiding-illegal-immigrants,Fox News
Christmas quiz! How well do you know these facts about the annual celebration of the birth of Christ? Test your knowledge in this festive lifestyle quiz.,2022,https://www.foxnews.com/lifestyle/christmas-quiz-how-well-know-facts-annual-holiday,Fox News
"Conservatives on Twitter ripped House Speaker Nancy Pelosi, D-Calif., for accidentally saying, ""Happy Shwanza"" during remarks to Congress on Friday.",2022,https://www.foxnews.com/media/pelosi-mocked-wishing-americans-happy-shwanza-during-final-speech-house-speaker,Fox News
"The U.S. health regulator on Wednesday approved TG Therapeutics Inc's <a href=""https://www.reuters.com/companies/TGTX.O"" target=""_blank"">(TGTX.O)</a> drug for patients with relapsing forms of multiple sclerosis, pitting it against rivals from Roche <a href=""h…",2022,https://www.reuters.com/business/healthcare-pharmaceuticals/us-fda-approves-tg-therapeutics-multiple-sclerosis-drug-2022-12-28/,Reuters
South Africa's rand strengthened in early trade against the dollar on Wednesday amid thin trading in a holiday-curtailed week.,2022,https://www.reuters.com/world/africa/south-african-rand-strengthens-amid-thin-trading-2022-12-28/,Reuters
"A Houston-based company that reinforces plastic packaging for food and household goods is putting the public at risk of exposure to toxic ""forever chemicals,"" according to a new lawsuit brought by environmental and public health groups.",2022,https://www.reuters.com/legal/litigation/inhance-technologies-sued-over-pfas-plastic-food-containers-2022-12-28/,Reuters
"American Mikaela Shiffrin secured a giant slalom double in Semmering, Austria on Wednesday to claim her 79th World Cup victory, moving her within three wins of compatriot Lindsey Vonn's women's record of 82.",2022,https://www.reuters.com/lifestyle/sports/shiffrin-completes-giant-slalom-double-79th-world-cup-win-2022-12-28/,Reuters
Futures for Canada's main stock index edged up on Wednesday as investors returned from a long holiday weekend to global optimism over China moving towards reopening its economy.,2022,https://www.reuters.com/markets/tsx-futures-edge-higher-investors-eye-china-reopening-2022-12-28/,Reuters
"Israel could attack Iranian nuclear sites in two or three years, its defence minister said on Wednesday, in unusually explicit comments about a possible timeline.",2022,https://www.reuters.com/world/middle-east/israeli-minister-sees-possible-attack-iran-two-or-three-years-2022-12-28/,Reuters
"The Biden administration is planning to use pandemic-era restrictions to expel many Cuban, Nicaraguan and Haitian migrants caught at the southwest border back to Mexico, while simultaneously allowing some to enter the United States by air on humanitarian grou…",2022,https://www.reuters.com/world/us/us-plans-expand-border-expulsions-cubans-nicaraguans-haitians-sources-2022-12-28/,Reuters
"A U.S. appeals court on Wednesday revived a lawsuit accusing Alphabet Inc's <a href=""https://www.reuters.com/companies/GOOGL.O"" target=""_blank"">(GOOGL.O)</a> Google and several other companies of violating the privacy of children under age 13 by tracking thei…",2022,https://www.reuters.com/technology/google-youtube-content-providers-must-face-us-childrens-privacy-lawsuit-2022-12-28/,Reuters
Atletico Madrid coach Diego Simeone said that he is mainly responsible for the team's situation as they have failed to find their best form and sit in fifth place in LaLiga.,2022,https://www.reuters.com/lifestyle/sports/simeone-takes-blame-atleticos-struggles-2022-12-28/,Reuters
Paris St Germain captain Marquinhos scored at both ends against Racing Strasbourg before a last-gasp Kylian Mbappe penalty secured the Ligue 1 leaders a 2-1 victory on Wednesday even though they were reduced to 10 men midway through the second half after Neym…,2022,https://www.reuters.com/lifestyle/sports/mbappe-scores-late-penalty-secure-psg-2-1-win-over-strasbourg-2022-12-28/,Reuters
"Nearly two weeks after Luiz Inacio Lula da Silva defeated far-right President Jair Bolsonaro in Brazil's most fraught election in a generation, Milton Baldin arrived in the capital Brasilia to try to overturn the result.",2022,https://www.reuters.com/world/americas/coup-mongering-bolsonaristas-battle-cry-reveals-radicalized-brazil-2022-12-28/,Reuters
"Canada's First Quantum Minerals Ltd <a href=""https://www.reuters.com/companies/FM.TO"" target=""_blank"">(FM.TO)</a> said on Wednesday its flagship Cobre Panama copper mine was currently running as normal and formal talks have resumed with the Panama government …",2022,https://www.reuters.com/markets/commodities/canadas-first-quantum-says-no-disruption-panama-ops-amid-dispute-2022-12-28/,Reuters
The U.S. and UK face a dilemma in Nigeria: How to support the government's war on insurgents while holding the military to account for human rights abuses.,2022,https://www.reuters.com/investigates/special-report/nigeria-military-international/,Reuters
"U.S. Transportation Secretary Pete Buttigieg said that large-scale flight schedule disruptions at Southwest Airlines <a href=""https://www.reuters.com/companies/LUV.N"" target=""_blank"">(LUV.N)</a> were no longer a weather-driven issue and showed a ""system failu…",2022,https://www.reuters.com/world/us/southwest-airlines-flight-disruptions-no-longer-weather-driven-us-says-2022-12-28/,Reuters
"The rouble weakened on Wednesday, sliding past the 71 mark against the dollar, as sanctions on Russian oil and their probable impact on export revenues put pressure on the Russian currency.",2022,https://www.reuters.com/markets/currencies/russian-rouble-slips-again-volatile-year-end-trade-continues-2022-12-28/,Reuters
"European shares inched up on Wednesday, with UK's FTSE 100 outpacing peers after a long Christmas holiday weekend as investors assessed Beijing's steps towards reopening its COVID-battered economy.",2022,https://www.reuters.com/markets/europe/european-shares-edge-up-investors-assess-china-reopening-2022-12-28/,Reuters
"Russia and China have completed naval drills in the East China Sea, after a week of joint exercises which included practising how to capture an enemy submarine with depth charges and firing artillery at a warship, Russia's defence ministry said.",2022,https://www.reuters.com/world/russia-china-hold-naval-drills-practise-submarine-capture-2022-12-28/,Reuters
"It has been a rough 12 months for emerging markets that have seen more governments stumble into default, currencies suffer and double-digit losses in stocks and bonds alike - though many <a href=""/markets/em-bulls-outnumber-bears-first-time-since-july-2021-hs…",2022,https://www.reuters.com/markets/emerging/what-investors-watch-out-emerging-markets-2023-2022-12-28/,Reuters
"Serbs in northern Kosovo who have been blocking roads for the past 19 days in a protest against the arrest of a former policeman will start removing barricades Thursday morning, Serbian President Aleksandar Vucic said on Wednesday evening.",2022,https://www.reuters.com/world/europe/serbs-northern-kosovo-remove-barricades-serbias-vucic-says-2022-12-28/,Reuters
"Some of the biggest securities cases of 2023 are surely yet to come, but major litigation is already on the docket. Courts are set to grapple with whether Elon Musk defrauded Tesla shareholders, whether investors can sue over misstatements in direct listings …",2022,https://www.reuters.com/legal/government/shareholders-v-tesla-nasdaqs-diversity-rule-securities-cases-watch-2023-2022-12-28/,Reuters
"Japan on Wednesday recorded 415 COVID-19 deaths, the highest-ever count for a single day, <a href=""https://covid19.mhlw.go.jp/en/"" target=""_blank"">health ministry data</a> showed.",2022,https://www.reuters.com/world/asia-pacific/japan-marks-record-415-covid-19-deaths-health-ministry-2022-12-28/,Reuters
"ABB <a href=""https://www.reuters.com/companies/ABBN.S"" target=""_blank"">(ABBN.S)</a> has completed the sale of its remaining 19.9% stake in the power grids business it sold to Hitachi <a href=""https://www.reuters.com/companies/6501.T"" target=""_blank"">(6501.T)<…",2022,https://www.reuters.com/business/energy/abb-gets-14-bln-after-completing-power-grids-sale-hitachi-2022-12-28/,Reuters
"Prime Minister-designate Benjamin Netanyahu finalised coalition deals with allied parties, their spokespeople said on Wednesday, in final steps toward his political comeback at the head of one of the most right-wing governments in Israel's history.",2022,https://www.reuters.com/world/middle-east/israels-netanyahu-seals-coalition-deals-with-rightist-religious-allies-2022-12-28/,Reuters
"Turkish Airlines <a href=""https://www.reuters.com/companies/THYAO.IS"" target=""_blank"">(THYAO.IS)</a> carried just over 72 million passengers this year and sees that rising to more than 88 million next year, the chairman of the national carrier said, according…",2022,https://www.reuters.com/business/aerospace-defense/turkish-airlines-expects-more-than-88-mln-passengers-2023-anadolu-2022-12-28/,Reuters
Kosovo closed its biggest border crossing on Wednesday after protesters blocked it on the Serbian side to support their ethnic kin in Kosovo in refusing to recognise the country's independence.,2022,https://www.reuters.com/world/europe/kosovo-closes-main-border-crossing-after-roadblock-serbia-2022-12-28/,Reuters
"Bolivian police have detained Luis Fernando Camacho, the governor of Santa Cruz and a prominent opposition leader, Bolivia's interior minister Carlos Eduardo del Castillo del Carpio said on Wednesday on Twitter.",2022,https://www.reuters.com/world/americas/bolivian-police-detain-opposition-governor-interior-minister-says-2022-12-28/,Reuters
"Shares of Tesla Inc <a href=""https://www.reuters.com/companies/TSLA.O"" target=""_blank"">(TSLA.O)</a> snapped a seven-session losing streak on Wednesday, in their rare rise this month on the way to what will be the electric-vehicle maker's worst year on record.",2022,https://www.reuters.com/business/autos-transportation/tesla-shares-record-rare-jump-this-month-way-worst-year-2022-12-28/,Reuters
"Turkish President Tayyip Erdogan eliminated the retirement age requirement on Wednesday in a move that allows more than 2 million workers to retire immediately, less than six months before an election.",2022,https://www.reuters.com/world/middle-east/turkey-eliminates-age-requirement-retirement-2022-12-28/,Reuters
Jamaican Prime Minister Andrew Holness renewed states of emergency in eight parishes on Wednesday to control an ongoing threat of crime linked to gang activity in the Caribbean nation.,2022,https://www.reuters.com/world/americas/jamaica-renews-regional-states-emergency-due-gang-violence-2022-12-28/,Reuters
Sam Bankman-Fried is expected to enter a plea next week to criminal charges he defrauded investors and looted billions of dollars in customer funds at his failed FTX cryptocurrency exchange.,2022,https://www.reuters.com/legal/sam-bankman-fried-enter-plea-ftx-fraud-case-2022-12-28/,Reuters
Rafael Nadal is hoping that playing in the United Cup will give him the confidence boost he needs as he looks to defend his Australian Open title next month after being plagued by injuries in 2022.,2022,https://www.reuters.com/lifestyle/sports/nadal-looks-get-back-winning-ways-after-injury-ravaged-2022-season-2022-12-28/,Reuters
The Kremlin on Wednesday said it supported Serbia's attempts to protect ethnic Serbs in northern Kosovo but denied Pristina's accusation that Russia was somehow stoking tensions in an attempt to sow chaos across the Balkans.,2022,https://www.reuters.com/world/europe/kremlin-denies-kosovan-claims-that-russia-is-pushing-serbia-stoke-tensions-2022-12-28/,Reuters
"The Ugandan shilling weakened for a second straight day on Wednesday, undermined by a spike in demand for dollars from importers and commercial banks, traders said.",2022,https://www.reuters.com/world/africa/uganda-shilling-weakens-due-surge-commercial-bank-importer-demand-2022-12-28/,Reuters
Connor McDavid scored the winning goal in the third period to run his point-scoring streak to 16 games and lead the visiting Edmonton Oilers to an entertaining 2-1 victory over the Calgary Flames on Tuesday.,2022,https://www.reuters.com/lifestyle/sports/nhl-roundup-connor-mcdavid-extends-point-streak-16-oilers-win-2022-12-28/,Reuters
"There is no risk to power supplies in France until at least mid-January, the head of the country's CRE energy watchdog, Emmanuelle Wargon, said on Wednesday.",2022,https://www.reuters.com/world/europe/frances-energy-watchdog-sees-no-risk-power-supplies-until-least-mid-january-2022-12-28/,Reuters
"Pope Francis on Wednesday asked for prayers for former pope Benedict, saying he is ""very sick"".",2022,https://www.reuters.com/world/pope-francis-asks-prayers-ex-pope-benedict-who-he-says-is-very-sick-2022-12-28/,Reuters
Efforts to remove carbon dioxide (CO2) from the atmosphere and store it underground storage have gained steam across Europe over the past few years as industries and governments seek to reduce emissions to meet their climate goals.,2022,https://www.reuters.com/world/europe/carbon-capture-storage-projects-across-europe-2022-12-28/,Reuters
"So long, “total addressable market”. Farewell, “flywheel effect”. Silicon Valley has a new buzzword. As the cost of signing up new customers rises, “lifetime value” is set to become must-use jargon for technology executives, investors and analysts in 2023. Co…",2022,https://www.reuters.com/breakingviews/lifetime-value-is-silicon-valleys-next-buzzword-2022-12-28/,Reuters
India's power regulator on Wednesday retained a price cap of 12 rupees ($0.1450) per unit on electricity traded on its spot power exchanges ahead of expected record energy demand in the coming summer months.,2022,https://www.reuters.com/business/energy/indian-power-regulator-retains-price-cap-electricity-exchanges-2022-12-28/,Reuters
"Like dogs seeking forever homes, stray pet businesses will find new owners in 2023. Splurging on furry and feathered friends has proven to be inflation-proof, even as exuberant pandemic-fueled valuations have cooled off. Big companies are the best candidates …",2022,https://www.reuters.com/breakingviews/stray-pet-businesses-will-find-new-owners-2023-2022-12-28/,Reuters
"The Bank of Japan's decision to raise its bond-yield ceiling could be the first step toward normalising ultra-easy policy, Takatoshi Ito, a Columbia University professor who is close to BOJ Governor Haruhiko Kuroda, wrote in a column on Tuesday.",2022,https://www.reuters.com/markets/asia/academic-close-japans-kuroda-says-boj-moving-towards-policy-normalisation-2022-12-28/,Reuters
"As the sun set on a courtyard of shipping containers in Ghana's capital Accra, young men and women in Pink Floyd, Grateful Dead and tie-dye tees bartered over army surplus jackets and Adidas sneakers while a live deejay spun Afrobeat classics.",2022,https://www.reuters.com/lifestyle/ghanas-vintage-enthusiasts-give-new-life-western-clothing-waste-2022-12-28/,Reuters
"Britain urged Iran on Wednesday to stop detaining dual nationals following the <a href=""/world/middle-east/irans-guards-arrest-seven-people-linked-uk-over-protests-statement-2022-12-25/"">arrest</a> of seven people with links to the United Kingdom, saying the …",2022,https://www.reuters.com/world/britain-urges-iran-stop-unfairly-detaining-dual-nationals-2022-12-28/,Reuters
"When the lights go out and the power goes down in Kyiv, 18-year-old manicurist Elyzaveta Litvynchuk takes her gel lamp, electric nail file and her clients to one of the capital's ""invincibility points"" which offer back-up electricity from generators.",2022,https://www.reuters.com/world/europe/how-kyiv-manicurist-works-through-blackouts-2022-12-28/,Reuters
"Tunisia powerful UGTT Union on Wednesday approved a two-day strike by air, land and sea transport workers on Jan. 25 and 26, to protest against what it called ""the government's marginalisation of public companies"".",2022,https://www.reuters.com/world/africa/tunisian-union-approves-two-day-strike-by-transport-workers-2022-12-28/,Reuters
"England right back Reece James described 2022 as the ""toughest year to date"" on Wednesday after he picked up a fresh injury during Chelsea's 2-0 win over Bournemouth in the Premier League.",2022,https://www.reuters.com/lifestyle/sports/chelseas-james-says-2022-toughest-year-after-fresh-injury-woes-2022-12-28/,Reuters
"Imported baby formula would be subject to tariffs again in the new year, after the expiration of exemptions implemented amid a nationwide shortage, the Wall Street Journal <a href=""https://www.wsj.com/articles/baby-formula-imports-to-face-tariffs-again-in-202…",2022,https://www.reuters.com/world/us/baby-formula-imports-face-tariffs-again-2023-wsj-2022-12-28/,Reuters
"Aircraft lessor BOC Aviation Ltd <a href=""https://www.reuters.com/companies/2588.HK"" target=""_blank"">(2588.HK)</a> said on Wednesday it had ordered 40 Boeing Co <a href=""https://www.reuters.com/companies/BA.N"" target=""_blank"">(BA.N)</a> 737 MAX planes to be d…",2022,https://www.reuters.com/business/aerospace-defense/lessor-boc-aviation-orders-40-boeing-737-max-planes-2022-12-28/,Reuters
"Australia all-rounder Cameron Green will not bowl for the rest of the second test against South Africa in Melbourne and has been ruled out of the third and final match in Sydney to recover from a broken finger, the team said on Wednesday.",2022,https://www.reuters.com/lifestyle/sports/australias-green-ruled-out-sydney-test-with-broken-finger-2022-12-28/,Reuters
"Japan's government will make raising wages a top priority in its economic policy next year, Deputy Chief Cabinet Secretary Seiji Kihara said on Wednesday.",2022,https://www.reuters.com/markets/asia/japan-make-raising-wages-top-priority-says-senior-govt-official-2022-12-28/,Reuters
"Bank of Japan (BOJ) policymakers saw the need to keep ultra-low interest rates but discussed growing prospects that higher wages could finally eradicate the risk of a return to deflation, a summary of opinions at their December meeting showed.",2022,https://www.reuters.com/markets/asia/boj-debated-chance-higher-wages-inflation-dec-meeting-summary-2022-12-28/,Reuters
"South Korea's exports likely extended their falling streak to a third straight month in December, a Reuters poll showed on Wednesday, with demand from China yet to recover from loosening COVID-19 restrictions.",2022,https://www.reuters.com/markets/asia/south-korea-dec-exports-fall-third-month-china-demand-still-weak-2022-12-28/,Reuters
"South Africa were 15 for one, still needing 371 runs to make Australia bat again, before rain halted play after tea on day three of the second test at the Melbourne Cricket Ground on Wednesday.",2022,https://www.reuters.com/lifestyle/sports/south-africa-15-1-rain-halts-second-test-v-australia-2022-12-28/,Reuters
"U.S. stock investors could not be more eager to turn the page on 2022, a brutal year dominated by market-punishing Federal Reserve rate hikes designed to tamp down the steepest inflation in 40 years.",2022,https://www.reuters.com/markets/us/inflation-recession-earnings-among-factors-drive-us-stocks-2023-2022-12-28/,Reuters
A United Airlines pilot adopted a puppy abandoned at San Francisco International Airport after it arrived from China. The owner didn't have the proper paperwork upon landing in the U.S.,2022,https://www.foxnews.com/us/pilot-adopts-puppy-abandoned-owner-san-francisco-airport-documentation-issue,Fox News
Chris Hayes speaks with longtime China expert Bill Bishop about what China's rollback of its strict Covid policies means.,2022,https://www.msnbc.com/msnbc-podcast/why-is-this-happening/discussing-what-end-zero-covid-china-means-bill-bishop-podcast-n1302189,MSNBC
"Bulgaria's foreign ministry said it would summon on Thursday the Russian ambassador to Sofia ""for explanations"" after Moscow put Christo Grozev, a Bulgarian citizen and the executive director of investigative news outlet Bellingcat, on a wanted list.",2022,https://www.reuters.com/world/europe/bulgaria-summons-russian-envoy-over-bellingcat-journalist-grozev-2022-12-29/,Reuters
"Poland is prepared for a Russian ban on oil sales to countries implementing a price cap, the climate minister said on Thursday, with the country having cut its intake of Russian crude and secured alternative supplies from producers such as Saudi Arabia.",2022,https://www.reuters.com/business/energy/poland-ready-russian-oil-ban-says-minister-2022-12-29/,Reuters
"A fire halted operations on Wednesday at a coking plant of Petromonagas, a joint venture of the state oil companies of Venezuela and Russia, four sources told Reuters, adding that no one was injured.",2022,https://www.reuters.com/world/americas/fire-halts-venezuelas-petromonagas-coking-plant-sources-2022-12-29/,Reuters
