sentence,pub_year,news_link,outlet
"Hundreds of Amazon workers at a warehouse in Coventry, central England, have voted to walk out in the new year in a dispute over pay, the union representating the staff said on Friday.",2022,https://www.reuters.com/world/uk/uk-amazon-workers-coventry-warehouse-vote-strike-action-union-2022-12-16/,Reuters
"Mike Ashley's Frasers Group <a href=""https://www.reuters.com/companies/FRAS.L"" target=""_blank"">(FRAS.L)</a> said on Friday it has bought shares in premium fashion brands of JD Sports <a href=""https://www.reuters.com/companies/JD.L"" target=""_blank"">(JD.L)</a> …",2022,https://www.reuters.com/markets/deals/mike-ashleys-frasers-buys-premium-fashion-brands-retailer-jd-sports-2022-12-16/,Reuters
"Ukraine President Volodymyr Zelenskiy has asked world soccer's governing body FIFA to let him share a message of peace before Sunday's World Cup final, CNN reported on Friday, as Russia launched one of its biggest attacks in the war.",2022,https://www.reuters.com/world/ukraines-zelenskiy-wants-deliver-peace-message-before-world-cup-final-cnn-2022-12-16/,Reuters
A federal judge has paused the Biden administration's attempt to end a controversial Trump-era immigration policy that forced tens of thousands of migrants to stay in Mexico to await U.S. hearings on their asylum claims.,2022,https://www.reuters.com/legal/government/bidens-bid-end-remain-mexico-immigration-policy-blocked-by-judge-2022-12-16/,Reuters
"U.S. basketball star Brittney Griner, who on Friday left an Army medical center where she had been recuperating following her release from a Russian penal colony as part of a prisoner swap, said she would work to help bring other detained Americans home and p…",2022,https://www.reuters.com/lifestyle/sports/brittney-griner-released-medical-center-texas-military-base-cnn-2022-12-16/,Reuters
"Setting a ceiling on the price of European gas would do more harm than good. European Union energy ministers will meet <a href=""https://www.bloomberg.com/news/articles/2022-12-13/eu-gets-closer-to-gas-cap-but-still-haggling-over-price?srnd=premium-europe&sref…",2022,https://www.reuters.com/breakingviews/eu-gas-price-cap-will-be-self-defeating-2022-12-16/,Reuters
"Protesters blocked key roads and forced the closure of five airports in Peru amid violent protests that flared up again on Friday and have left at least 16 dead, following the ousting and arrest of former President Pedro Castillo.",2022,https://www.reuters.com/world/americas/peru-protests-blockade-roads-force-five-airports-close-2022-12-16/,Reuters
"""Avatar: The Way of Water"" pulled in $17 million at U.S. and Canadian box offices from its first showings on Thursday night, distributor Walt Disney Co <a href=""https://www.reuters.com/companies/DIS.N"" target=""_blank"">(DIS.N)</a> said.",2022,https://www.reuters.com/lifestyle/avatar-sequel-takes-17-million-domestically-first-night-screenings-2022-12-16/,Reuters
"Accenture Plc surpassed Wall Street estimates for quarterly revenue on Friday, a sign that IT spending is holding strong even as economic headwinds pressure businesses.",2022,https://www.reuters.com/business/accenture-beats-quarterly-revenue-estimates-2022-12-16/,Reuters
"Chinese officials have agreed to form a global sovereign debt ""roundtable"" that would include a wide variety of stakeholders, including private sector creditors, International Monetary Fund chief Kristalina Georgieva said on Thursday.",2022,https://www.reuters.com/world/china/china-agreed-form-global-sovereign-debt-roundtable-imf-chief-2022-12-16/,Reuters
"Shares of Faraday Future Intelligent Electric <a href=""https://www.reuters.com/companies/FFIE.O"" target=""_blank"">(FFIE.O)</a> tumbled 21% premarket on Friday after the company <a href=""/business/autos-transportation/faraday-future-targets-april-ev-deliveries-…",2022,https://www.reuters.com/business/autos-transportation/faraday-future-slides-signaling-need-funds-start-production-2022-12-16/,Reuters
"Ten people, including five children, were killed - according to a provisional death toll - after a fire broke out on Friday morning at a residential building in Vaulx-en-Velin, near the French city of Lyon, the local government said.",2022,https://www.reuters.com/world/europe/10-dead-including-5-children-by-fire-building-near-french-city-lyon-2022-12-16/,Reuters
"The Indian rupee was a tad lower to the U.S. currency on Friday, with dollar sales by public sector banks saving the local currency from bigger declines.",2022,https://www.reuters.com/markets/currencies/india-rupee-rupee-marginally-lower-psu-banks-help-limit-losses-traders-2022-12-16/,Reuters
"European Union states should buy arms jointly to replenish stocks after supplying Ukraine, said the bloc's defence agency, warning the United States may not always be able to shield Europe from threats.",2022,https://www.reuters.com/world/europe/eu-defence-agency-chief-europe-cannot-rely-us-alone-shield-2022-12-16/,Reuters
"Fiji's military chief said his forces will not intervene over a national election that took place on Wednesday, after opposition leaders wrote to him raising concerns over vote-counting.",2022,https://www.reuters.com/world/asia-pacific/fiji-military-says-wont-intervene-over-election-after-opposition-complaint-2022-12-16/,Reuters
Mortgage lender Halifax said on Friday it expected British house prices to fall next year by around 8% as the increasing cost of living put more pressure on household finances and rising interest rates continued to push up mortgage costs.,2022,https://www.reuters.com/world/uk/halifax-says-uk-house-prices-set-fall-next-year-by-around-8-2022-12-16/,Reuters
"A <a href=""/world/asia-pacific/around-100-people-feared-trapped-malaysia-landslide-fire-department-2022-12-15/"">landslide</a> killed at least 18 people, among them children, as they slept in their tents at a campsite in Malaysia on Friday, officials said, as …",2022,https://www.reuters.com/world/asia-pacific/major-landslides-malaysia-2022-12-16/,Reuters
"Moscow on Friday welcomed Turkish President Tayyip Erdogan's <a href=""/world/turkey-seeks-trilateral-mechanism-with-russia-syria-erdogan-2022-12-15/"">proposal</a> to establish a three-way mechanism for diplomacy between Turkey, Russia and Syria, Russian state…",2022,https://www.reuters.com/world/moscow-welcomes-turkeys-call-trilateral-syria-diplomacy-2022-12-16/,Reuters
UK's main stock indexes fell on Friday as major central banks stuck to their hawkish stance on interest rates and as an unexpected drop in British retail sales also fuelled concerns about an economic downturn.,2022,https://www.reuters.com/markets/europe/uks-ftse-falls-weak-retail-sales-adds-economic-growth-concerns-2022-12-16/,Reuters
"The Bank of Japan will be the last of the major central banks to hold a policy meeting this year, and policy-makers in emerging economies also mark the year-end with rates decisions.",2022,https://www.reuters.com/business/take-five/global-markets-themes-graphic-pix-2022-12-16/,Reuters
"Senegal on Thursday issued a 150 billion CFA franc ($232.31 million) 12-year treasury bond to finance its 2023 budget, said NSIA Bank, a lead manager of the auction.",2022,https://www.reuters.com/world/africa/senegal-issues-12-year-treasury-bond-150-bln-cfa-francs-nsia-bank-2022-12-16/,Reuters
"Norwegian oil firm Aker BP <a href=""https://www.reuters.com/companies/AKRBP.OL"" target=""_blank"">(AKRBP.OL)</a> and its partners will invest more than 200 billion crowns ($20.46 billion) in 2022 money to develop several oil and gas fields off Norway in the com…",2022,https://www.reuters.com/business/energy/aker-bp-partners-invest-205-bln-new-oil-gas-projects-2022-12-16/,Reuters
"An Italian court on Monday agreed to hand over to Belgian authorities a woman suspected of involvement in a <a href=""/world/europe/european-parliaments-cash-for-influence-scandal-2022-12-13/"">Qatar graft scandal</a> that has rocked the European Parliament.",2022,https://www.reuters.com/world/europe/italy-agrees-transfer-suspect-eu-graft-scandal-belgium-2022-12-19/,Reuters
"Taiwan's government has opened a probe into Chinese-owned social media platform TikTok on suspicion of illegally operating a subsidiary on the island, and warned that the social media platform was being used by Beijing to spread disinformation.",2022,https://www.reuters.com/technology/taiwan-probes-tiktok-suspected-illegal-operations-2022-12-19/,Reuters
"Australia on Monday opened up its first zone for developing offshore wind farms in a region off its southern coast, looking to jumpstart a new industry to help achieve net zero carbon emissions by 2050.",2022,https://www.reuters.com/business/energy/australia-opens-up-first-zone-offshore-wind-farms-2022-12-19/,Reuters
"Members of Russia's Pussy Riot band were detained on Sunday after trying to storm the pitch at the World Cup final in Qatar to protest the war in Ukraine, the imprisonment of Russian opposition leader Alexei Navalny and the oppression of women in Iran, activi…",2022,https://www.reuters.com/world/pussy-riot-members-detained-world-cup-final-activists-say-2022-12-19/,Reuters
"China reported two new COVID-19 deaths for Dec 18, compared with none the previous day, increasing the nation's fatalities to 5,237, the National Health Commission said on Monday.",2022,https://www.reuters.com/world/china/china-reports-two-new-covid-deaths-dec-18-vs-none-day-earlier-2022-12-19/,Reuters
"Australian Foreign minister Penny Wong will visit China this week, Prime Minister Anthony Albanese said on Monday, signalling an improvement in diplomatic relations between Beijing and Canberra.",2022,https://www.reuters.com/world/asia-pacific/australia-foreign-minister-visit-china-diplomatic-ties-improve-2022-12-19/,Reuters
South Korea's finance minister said on Monday the economy is slowing at a more rapid pace than previously expected and would bottom in the first half of next year.,2022,https://www.reuters.com/world/asia-pacific/south-koreas-economic-slump-bottom-h1-2023-finance-minister-2022-12-18/,Reuters
"Headhunter Candice knows the COVID-19 infections engulfing Beijing and much of China will soon hit her home of Shenzhen city, but she would rather face it without a vaccine booster, saying she fears potential side effects more than the virus.",2022,https://www.reuters.com/world/china/i-dont-trust-it-vaccine-hesitancy-lingers-even-china-covid-cases-surge-2022-12-19/,Reuters
"Shorting the Bank of Japan <a href=""https://www.reuters.com/companies/8301.T"" target=""_blank"">(8301.T)</a> is the trade of 2023. Gyrations in Japanese bond yields resulting from an abrupt increase in benchmark interest rates could force indebted domestic enti…",2022,https://www.reuters.com/breakingviews/traders-will-anxiously-watch-bank-japan-2022-12-19/,Reuters
"Italy's football federation (FIGC) has authorised the introduction of SAOT technology, the semi-automatic offside detection system, from Jan. 27, it announced on Monday.",2022,https://www.reuters.com/lifestyle/sports/serie-will-have-semi-automatic-offside-detection-jan-27-figc-2022-12-19/,Reuters
"Colombia has lost 86,985 hectares (214,944 acres) of Amazon jungle in the first nine months of the year while fires burned through swathes of felled areas, a local advocacy group said on Monday.",2022,https://www.reuters.com/world/americas/colombia-lost-86985-hectares-forest-through-sept-30-this-year-report-2022-12-19/,Reuters
"Refiner Citgo Petroleum is on track for a $2.5 billion profit this year, which it plans to use for repaying debt and invest in the reliability of its operations, the board that supervises the Houston-based company said on Monday.",2022,https://www.reuters.com/business/energy/citgo-petroleum-track-25-bln-profit-2022-supervisory-board-2022-12-19/,Reuters
"Kirkland & Ellis has cemented its launch in Miami by inking a lease in a new 55-story tower that has also attracted other major law firms, including Winston & Strawn, Sidley Austin and Baker McKenzie.",2022,https://www.reuters.com/legal/legalindustry/kirkland-inks-office-lease-expanding-miami-legal-market-2022-12-19/,Reuters
Real Madrid coach Carlo Ancelotti said he plans to stay at the Spanish club until his contract expires in June 2024 following reports of a possible move to the Brazilian national team.,2022,https://www.reuters.com/lifestyle/sports/ancelotti-plans-stay-real-madrid-until-2024-2022-12-19/,Reuters
"French airport operator Vinci <a href=""https://www.reuters.com/companies/SGEF.PA"" target=""_blank"">(SGEF.PA)</a> will invest $820 million in renovating an airport in the Mexican business hub of Monterrey in the northern state of Nuevo Leon, the state's governo…",2022,https://www.reuters.com/business/frances-vinci-invest-820-mln-mexico-airport-governor-says-2022-12-19/,Reuters
A U.S. appeals court on Monday said the White House could not require federal contractors to ensure that their workers are vaccinated against COVID-19 as a condition of government contracts.,2022,https://www.reuters.com/legal/appeals-court-says-us-cannot-mandate-federal-contractor-covid-19-vaccines-2022-12-19/,Reuters
"In Part 1 of this article (<a href=""https://reut.rs/3W3ymDd"" target=""_blank"">https://reut.rs/3W3ymDd</a>), we gave our insights into takeover opportunities in the UK and issues that may arise for international bidders. In this Part 2, we also look at the impa…",2022,https://www.reuters.com/legal/transactional/uk-capital-markets-everything-must-go-part-2-2022-12-19/,Reuters
"Japan's budget proposal for the 2023-2024 fiscal year could be as high as 114 trillion yen, the Nikkei reported, adding that the government could issue more than 35 trillion yen in bonds.",2022,https://www.reuters.com/markets/asia/japan-budget-proposal-fy202324-could-be-high-114-trln-yen-nikkei-2022-12-19/,Reuters
"Train guards at France's state-owned railway operator SNCF decided on Monday to go ahead with a strike planned for the Christmas and New Year weekends, the SUD Rail union said.",2022,https://www.reuters.com/business/autos-transportation/french-train-guards-go-ahead-with-christmas-new-year-strike-union-2022-12-19/,Reuters
"The Ukrainian atomic energy agency accused Russia on Monday of flouting nuclear safety by sending a ""kamikaze"" drone over part of the South Ukraine Nuclear Power Plant in the Mykolaiv region just after midnight.",2022,https://www.reuters.com/world/kyiv-says-russian-kamikaze-drone-flies-over-south-ukraine-nuclear-plant-2022-12-19/,Reuters
"Clean power producer Rezolv and British renewable energy investment firm Low Carbon will construct two onshore wind farms in Romania with combined capacity of up to 600 megawatts, Rezolv said on Monday.",2022,https://www.reuters.com/world/europe/rezolv-low-carbon-construct-two-onshore-wind-farms-romania-2022-12-19/,Reuters
"The Indian rupee rose against the dollar on Monday as the greenback declined against its major peers, while forward premiums added to last week's surge.",2022,https://www.reuters.com/markets/currencies/india-rupee-rupee-gains-dollar-index-slips-forward-premiums-climb-2022-12-19/,Reuters
"China Evergrande Group's <a href=""https://www.reuters.com/companies/3333.HK"" target=""_blank"">(3333.HK)</a> shareholding in its property services unit has fallen to 51.71% from 58.18% after forced selling of pledged shares by a third party, a Hong Kong <a href…",2022,https://www.reuters.com/world/china/china-evergrandes-stake-services-unit-drops-517-forced-selling-filing-2022-12-19/,Reuters
"The next World Trade Organization ministerial conference will be held in Abu Dhabi, United Arab Emirates in February 2024, the global trade watchdog confirmed in a statement on Twitter on Monday.",2022,https://www.reuters.com/world/middle-east/united-arab-emirates-host-next-major-wto-meeting-feb-2024-2022-12-19/,Reuters
"Japan is sounding out major oil refiners about buying Russian ultra light crude from the Sakhalin-2 gas and oil project to ensure that the plant can continue to operate smoothly, two sources with direct knowledge of the talks said.",2022,https://www.reuters.com/business/energy/japan-sounds-out-oil-refiners-buying-russian-oil-sakhalin-2-sources-2022-12-19/,Reuters
"England have named former captain Steve Borthwick as head coach to replace Eddie Jones who was dismissed earlier this month, the Rugby Football Union (RFU) said on Monday, with the build-up to next year's World Cup at the top of his agenda.",2022,https://www.reuters.com/lifestyle/sports/england-appoint-borthwick-new-head-coach-replace-sacked-jones-2022-12-19/,Reuters
"The Kremlin dismissed the idea that President Vladimir Putin was travelling to Belarus on Monday in order to push Minsk to take a more active role in the conflict in Ukraine, the RIA Novosti news agency reported.",2022,https://www.reuters.com/world/kremlin-rejects-suggestions-putin-will-push-belarus-join-ukraine-conflict-2022-12-19/,Reuters
"BlackRock <a href=""https://www.reuters.com/companies/BLK.N"" target=""_blank"">(BLK.N)</a> plans no major changes to the way it engages with companies and votes on environmental and social issues in the year ahead, despite a backlash against its stance on climat…",2022,https://www.reuters.com/business/sustainable-business/blackrock-plans-no-big-changes-esg-stance-despite-backlash-2022-12-19/,Reuters
"South Africa's Harmony Gold <a href=""https://www.reuters.com/companies/HARJ.J"" target=""_blank"">(HARJ.J)</a> on Monday reported a fatality at its Kusasalethu mine 90 kilometres (55.92 miles) west of Johannesburg after a fall-of-ground accident.",2022,https://www.reuters.com/world/africa/safricas-harmony-gold-reports-mine-fatality-2022-12-19/,Reuters
"A United Nations nature summit culminated on Monday with a global deal to protect the ecosystems that prop up half the world economy, and prevent the further loss of already ravaged <a href=""https://www.reuters.com/graphics/GLOBAL-ENVIRONMENT/PLANTS/jnpwyygyw…",2022,https://www.reuters.com/business/environment/30-by-30-key-takeaways-cop15-biodiversity-summit-2022-12-19/,Reuters
"New U.S. law student enrollment plummeted 11% in the fall, returning to earth after a surge last year, the American Bar Association reported on Monday.",2022,https://www.reuters.com/legal/legalindustry/law-schools-see-double-digit-decline-new-students-after-surge-2022-12-19/,Reuters
"U.S. Senator Jim Risch, the top Republican on the Senate Foreign Relations Committee, has requested a review of U.S. security assistance and cooperation programs in Nigeria following Reuters reporting on an illegal abortion program and killing of children car…",2022,https://www.reuters.com/world/senator-wants-review-us-security-assistance-nigeria-following-abortion-report-2022-12-19/,Reuters
"Malaysia's exports rose by 15.6% in November, above expectations, government data showed on Monday.",2022,https://www.reuters.com/markets/asia/malaysias-november-exports-rise-156-on-year-above-forecast-2022-12-19/,Reuters
"Macau's government said on Monday that it would cancel its regulations on risk zones in mainland China starting from Tuesday, the latest unwinding of stringent COVID-19 rules that have hammered revenues in the world's biggest gambling hub.",2022,https://www.reuters.com/world/asia-pacific/macaus-government-cancels-covid-risk-zones-mainland-china-2022-12-19/,Reuters
"Stronger Asia-Pacific mergers and acquisitions activity next year depends on improving macroeconomic conditions, after 2022 deals were held at eight-year lows by financing costs, weak equity markets and China's pandemic controls, dealmakers said.",2022,https://www.reuters.com/markets/asia/recovery-asia-ma-stuck-8-year-lows-rests-macro-conditions-2022-12-19/,Reuters
"The European Central Bank will hike interest rates further in the euro zone to combat high inflation, ECB's Vice-President Luis de Guindos said on Monday.",2022,https://www.reuters.com/markets/rates-bonds/ecb-will-hike-rates-further-we-do-not-know-when-will-stop-de-guindos-says-2022-12-19/,Reuters
"Indian banks have written off loans worth over 10 trillion rupees ($121.05 billion) in the last five financial years in an attempt to clean up their balance sheets, according to the federal government.",2022,https://www.reuters.com/world/india/indian-banks-wrote-off-over-121-bln-loans-five-years-govt-2022-12-19/,Reuters
"Capricorn Energy's <a href=""https://www.reuters.com/companies/CNE.L"" target=""_blank"">(CNE.L)</a> third-biggest shareholder, Palliser Capital, has called for a general meeting to set a vote on removing seven Capricorn directors from supervisory roles including…",2022,https://www.reuters.com/business/energy/capricorn-shareholder-palliser-calls-board-overhaul-meeting-documents-show-2022-12-19/,Reuters
For nearly two years the United States has tried and failed to negotiate a revival of the 2015 Iran nuclear deal yet Washington and its European allies refuse to close the door to diplomacy.,2022,https://www.reuters.com/world/us-leaves-door-open-iran-nuclear-diplomacy-2022-12-19/,Reuters
"The eldest child of Thai King Maha Vajiralongkorn is in a stable condition ""at a certain level"", with doctors using medication and equipment to support her lung, heart and kidney functions after she suffered a heart problem, the palace said on Monday.",2022,https://www.reuters.com/world/asia-pacific/thai-kings-hospitalised-daughter-stable-at-certain-level-royal-palace-2022-12-19/,Reuters
"With rising interest rates and limited supply putting home ownership out of reach for a growing number of people in emerging Europe, global and local real estate investors are placing bets on the region's nascent private rented sector.",2022,https://www.reuters.com/markets/europe/investors-eye-new-market-central-europe-homes-rent-2022-12-19/,Reuters
"In Britain, the damage wrought by rampant inflation can be seen in the fate of the humble egg.",2022,https://www.reuters.com/markets/commodities/britains-broken-egg-industry-shows-price-food-inflation-2022-12-19/,Reuters
"European shares edged higher on Monday, boosted by energy firms, after a bruising selloff last week sparked by growing fears of a recession as major central banks promised more interest rate hikes ahead.",2022,https://www.reuters.com/markets/europe/european-shares-edge-higher-after-brutal-selloff-last-week-2022-12-19/,Reuters
"The European Central Bank will not revise its mid-term price stability goal of 2% as that would undermine credibility, Vice-President Luis de Guindos said, adding that it was determined to keep raising interest rates to combat inflation.",2022,https://www.reuters.com/markets/rates-bonds/ecbs-de-guindos-says-changing-inflation-goal-will-hurt-credibility-2022-12-19/,Reuters
"French nuclear operator EDF <a href=""https://www.reuters.com/companies/EDF.PA"" target=""_blank"">(EDF.PA)</a> has further delayed the restart of several of its nuclear reactors affected by stress corrosion, in some cases until as late as June, as it struggles t…",2022,https://www.reuters.com/business/energy/edf-further-delays-restart-several-nuclear-plants-2022-12-19/,Reuters
"Ghana's finance ministry said on Monday it was suspending debt service payments on certain categories of external debt including Eurobonds, commercial loans and most bilateral debt, amid the worst economic crisis in a generation.",2022,https://www.reuters.com/world/africa/ghana-announces-external-debt-payment-suspension-slipping-into-default-2022-12-19/,Reuters
"The Bank of Japan is continuing large-scale monetary stimulus as the economy has not fully recovered from COVID-induced slump and as wage growth has lagged behind price hikes, former BOJ deputy governor Hiroshi Nakaso said on Monday.",2022,https://www.reuters.com/markets/asia/ex-boj-nakaso-sees-japan-lagging-exiting-stimulus-due-weak-economy-wages-2022-12-19/,Reuters
"Tunisia's anti-terrorism judge decided to imprison Ali Laarayedh, a former prime minister and senior official in the Islamist opposition Ennahda party, after hours of investigation into suspicions of sending jihadists to Syria, lawyers said on Monday.",2022,https://www.reuters.com/world/africa/tunisia-judge-imprisons-former-prime-minister-ali-laarayedh-lawyers-2022-12-19/,Reuters
"Swedish prosecutors asked a court to sentence two brothers accused of spying on behalf of Russia to life and 12 years in prison, respectively, as the trial concluded on Monday.",2022,https://www.reuters.com/world/europe/swedish-prosecutors-urge-life-sentence-man-russia-spy-trial-2022-12-19/,Reuters
"<a href=""/business/energy/eu-unity-stake-countries-try-break-gas-price-cap-impasse-2022-12-13/"">European Union</a> countries agreed on Monday to cap gas prices, after debating for months whether the measure could hinder rather than help Europe's efforts to co…",2022,https://www.reuters.com/markets/europe/europes-hard-fought-plan-cap-gas-prices-2022-12-19/,Reuters
"Fortescue Metals Group <a href=""https://www.reuters.com/companies/FMG.AX"" target=""_blank"">(FMG.AX)</a> said it had signed an agreement with Japan's Mitsubishi Corp <a href=""https://www.reuters.com/companies/8058.T"" target=""_blank"">(8058.T)</a> and Austria-bas…",2022,https://www.reuters.com/business/sustainable-business/australias-fortescue-metals-signs-deal-develop-green-iron-making-plant-2022-12-19/,Reuters
"The U.S. House of Representatives committee probing the Jan. 6, 2021, assault on the Capitol by Donald Trump supporters moves to wrap up its work this week with what could be as many as three criminal referrals against the former president.",2022,https://www.reuters.com/world/us/us-house-jan-6-capitol-riot-probe-consider-trump-criminal-referral-2022-12-19/,Reuters
A look at the day ahead in European and global markets from Anshuman Daga,2022,https://www.reuters.com/markets/global-markets-view-europe-2022-12-19/,Reuters
