sentence,pub_year,news_link,outlet
Mevlut Cavusoglu has declared Finland must lift the arms embargo on Turkey to join NATO. Cavusoglu made the comments when he met with Finland’s Defense Minister Antti Kaikkonen.,2022,https://www.foxnews.com/world/finland-must-lift-arms-embargo-turkey-order-join-nato-according-turkish-foreign-minister,Fox News
Arizona Rep. Andy Biggs is challenging Minority Leader Kevin McCarthy for speaker of the House during an official vote in January when the new Congressional takes power.,2022,https://www.foxnews.com/politics/andy-biggs-to-challenge-kevin-mccarthy-for-house-speaker-on-house-floor,Fox News
"Far-left billionaire George Soros is tied to at least 253 media organizations around the world, according to a new study conducted by the Media Research Center.",2022,https://www.foxnews.com/media/george-soros-influence-global-media-least-253-organizations-study-finds,Fox News
'The Five' co-hosts discuss how the left's climate hysteria affects children and how it could play a role in their development and how they see the world.,2022,https://www.foxnews.com/media/left-ripped-pushing-nightmarish-climate-narrative-children-apocalyptic-poisoning,Fox News
"Police in Illinois believe evidence suggests a husband and father of two killed his wife, two young daughters and his mother before killing himself in a ""horrific"" murder-suicide.",2022,https://www.foxnews.com/us/illinois-police-evidence-points-murder-suicide-after-5-family-members-found-dead-home,Fox News
"Semafor, a media outlet founded by the former editor of Buzzfeed news, is facing backlash for their criticism of Florida Gov. Ron DeSantis's relationship with right-leaning media.",2022,https://www.foxnews.com/media/desantis-spox-return-fire-mainstream-media-hit-piece-conservatives-fight-back,Fox News
"Playboy founder Hugh Hefner and former Lakers owner Jerry Buss were good friends, which resulted in the former being gifted a 2000 NBA title ring. It's now going on auction.",2022,https://www.foxnews.com/sports/playboy-founder-hugh-hefners-2000-lakers-title-ring-put-auction,Fox News
Are your family members snooping around your shared Amazon Prime account? Here's some surefire ways to keep Christmas gifts a surprise this holiday season.,2022,https://www.foxnews.com/tech/how-keep-your-amazon-gift-purchases-secret,Fox News
"Vanna White revealed she ""doesn't want to think about"" the end of her and Pat Sajak's time on the game show ""Wheel of Fortune."" White and Sajak have been co-hosts for decades.",2022,https://www.foxnews.com/entertainment/wheel-of-fortune-vanna-white-doesnt-want-think-end-game-show-pat-sajak,Fox News
PEACH STATE SHOWDOWN - Herschel Walker and Raphael Warnock set to face off in high-stakes Senate runoff,2022,https://www.foxnews.com/us/georgia-senate-runoff-herschel-walker-raphael-warnock,Fox News
Laggy iPhone browsing can often quickly be fixed by clearing a browser's cache. Here's how users can do it to make surfing the web on their devices faster.,2022,https://www.foxnews.com/tech/want-your-iphone-run-faster-heres-simple-fix,Fox News
"Green Bay Packers head coach Matt LaFleur said he ""absolutely"" wants Aaron Rodgers back for the 2023 season, even as the team has struggled this season with Rodgers under center.",2022,https://www.foxnews.com/sports/packers-matt-lafleur-absolutely-wants-aaron-rodgers-back-next-season,Fox News
"ABC's T.J. Holmes and Amy Robach’s extramarital affair is a ""gross violation of core Disney values,"" a former executive says, predicting they won't return to the air.",2022,https://www.foxnews.com/media/t-j-holmes-amy-robach-unseemly-affair-gross-violation-core-disney-values-former-abc-news-exec,Fox News
"A man is wanted in Georgia after using an ax to bust open a lottery machine inside a convenience store and stealing $2,800 last month, according to a local report.",2022,https://www.foxnews.com/us/ax-wielding-georgia-man-smashes-lottery-machine-steals-cash-convenience-store,Fox News
Tom Brady passed Peyton Manning for the most fourth-quarter comebacks of all-time and with that came a big superlative from three-time Super Bowl champion Mark Schlereth.,2022,https://www.foxnews.com/sports/tom-brady-worlds-greatest-american-super-bowl-champ-says,Fox News
"Bill Spindle, climate editor of the recently-launched Semafor, announced he is leaving the digital outlet, citing its ""over-dependence on Chevron sponsorship.""",2022,https://www.foxnews.com/media/semafor-climate-editor-exits-after-complaining-bosses-sites-over-dependence-on-chevron-sponsorship,Fox News
Eleven wastewater testing sites may be opening across Boston soon. This comes as COVID-19 levels in wastewater across the region are beginning to rise.,2022,https://www.foxnews.com/us/boston-planning-open-11-wastewater-testing-sites-across-city-help-monitor-covid-spikes,Fox News
Chicago police on Monday said that there were at least 17 people wounded and four killed in 13 shooting incidents that happened across the Windy City over the weekend.,2022,https://www.foxnews.com/us/chicago-weekend-gun-violence-sees-17-wounded-4-killed,Fox News
"The Washington Post reported on a study asserting that ""White men"" are overrepresented in Discovery Channel's ""Shark Week"" coverage every summer.",2022,https://www.foxnews.com/media/shark-week-blasted-overwhelmingly-featuring-white-men-shark-experts-washington-post-report,Fox News
"Portugal's Fernando Santos sat Cristiano Ronaldo in place of 21-year-old Gonçalo Ramos, and the decision paid off. Ramos scored a hat trick to help defeat Switzerland",2022,https://www.foxnews.com/sports/world-cup-2022-cristiano-ronaldos-replacement-scores-hat-trick-portugals-win-over-switzerland,Fox News
"Illegal immigrants were seen on videos posted to Instagram, crossing a U.S.-Mexico border fence before darting across a busy highway in El Paso, Texas.",2022,https://www.foxnews.com/us/texas-videos-show-illegal-immigrants-easily-crossing-border-dashing-across-highway,Fox News
"Republican are ready to oppose Democratic efforts to include progressive priorities, including abortion and racial equity, within the must-pass defense bill.",2022,https://www.foxnews.com/politics/gop-readies-fight-woke-provisions-defense-policy-bill,Fox News
"The Dec. 16 deadline for Congress to pass a new spending agreement to avoid a government shutdown is quickly approaching, but lawmakers are still at a “pretty significant impasse.""",2022,https://www.foxnews.com/politics/mcconnell-says-time-ticking-congress-pass-budget-bill,Fox News
Manchester United great Gary Neville slammed Portugal's Cristiano Ronaldo following Ronaldo's benching for the team's World Cup match against Switzerland Tuesday.,2022,https://www.foxnews.com/sports/former-manchester-united-captain-rips-cristiano-ronaldo-portugal-benched-world-cup-match,Fox News
"Minday Kaling said it would be difficult to make ""The Office"" today because people's tastes have changed, including ""what offends people.""",2022,https://www.foxnews.com/entertainment/mindy-kaling-says-most-characters-the-office-canceled-today,Fox News
Idaho police chief responds to criticism over the pace of the investigation surrounding the murders of four University of Idaho students in a Fox News cable exclusive.,2022,https://www.foxnews.com/media/moscow-idaho-police-chief-breaks-down-tears-university-murders-investigation-affects-us,Fox News
A toddler from Canada was caught on camera taking extra precautions when helping to unload the dishwasher with his family. His mom posted the video to TikTok — where it went viral.,2022,https://www.foxnews.com/lifestyle/caught-video-adorable-toddler-takes-precautions-unloading-dishwasher,Fox News
"Bill Cosby is facing a new sexual abuse lawsuit from five women who have long claimed to have been assaulted by Cosby. The suit also calls NBCUniversal, a studio and a production company complicit.",2022,https://www.foxnews.com/entertainment/bill-cosby-nbc-studio-face-new-sex-abuse-lawsuit-five-women-new-york,Fox News
Internal documents reveal the Oregon Education Association lost nearly 20 percent of its membership.,2022,https://www.foxnews.com/opinion/internal-documents-reveal-oregon-teachers-union-exodus-crisis-own-making,Fox News
Law enforcement agencies across the country made record setting fentanyl busts in 2022 after the drug has become the primary driver of the opioid crisis in recent years.,2022,https://www.foxnews.com/us/law-enforcement-agencies-across-country-made-several-record-setting-fentanyl-busts-2022,Fox News
AR Gov.-elect Sarah Huckabee Sanders announced Monday the appointment of veteran law enforcement officers Mike Hagar and A.J. Gary to head some of the state's top public safety posts.,2022,https://www.foxnews.com/politics/arkansas-gov-elect-sanders-appoints-veteran-law-enforcement-officers-top-public-safety-posts,Fox News
"Police in San Bernardino, California, fatally shot a man after responding to a tree that was set on fire. The man was wielding a wooden object and ignored police commands.",2022,https://www.foxnews.com/us/ca-police-fatally-shoots-man-who-lit-tree-fire-charged-officers-piece-wood,Fox News
"Nebraska Republican Governor Pete Ricketts on Tuesday tossed his hat into the ring to be appointed as the state's next U.S. Senator, following Sen. Ben Sasse's retirement.",2022,https://www.foxnews.com/politics/nebraska-republican-gov-pete-ricketts-seek-appointment-senate-ben-sasse-retires,Fox News
Democratic Reps. Rashida Tlaib and Ro Khanna joined climate activists on Capitol Hill Tuesday to protest against Sen. Joe Manchin's deal with party leadership.,2022,https://www.foxnews.com/politics/rashida-tlaib-ro-khanna-join-protests-expedited-oil-lease-permitting,Fox News
Hundreds of protesters stormed the Mongolian State Palace in response to what they say is corruption in the country's coal industry by top officials. The stolen coal is said to have been sold in China.,2022,https://www.foxnews.com/world/mongolian-protesters-try-storm-state-palace-alleging-corrupt-officials-sold-coal-china,Fox News
"Russia has released photos showing the deployment of mobile missile defense systems in the Kuril Islands, a chain that is part of a territorial dispute with Japan.",2022,https://www.foxnews.com/world/russia-deploys-missile-defense-systems-island-near-japan-vows-round-clock-watch,Fox News
Gladys Knight told Fox News Digital she looks at Patti LaBelle as a younger sister as the two have managed to remain friends for six decades.,2022,https://www.foxnews.com/entertainment/gladys-knight-decades-long-friendship-patti-labelle,Fox News
Fox News host Jesse Watters blasts Democrats and Hollywood for awarding themselves while the rest of America struggles on 'Jesse Watters Primetime.',2022,https://www.foxnews.com/media/jesse-watters-dems-hollywood-turned-kennedy-center-honors-into-new-oscars,Fox News
"Kirstie Alley died after an ""unexpected"" battle with cancer. Hollywood stars, including John Travolta, are honoring the actress following her death.",2022,https://www.foxnews.com/entertainment/john-travolta-jamie-lee-curtis-hollywood-react-death-kirstie-alley,Fox News
Tom Brady was seen screaming at his teammates on the sideline after the Tampa Bay Buccaneers punted to start the fourth quarter against the New Orleans Saints.,2022,https://www.foxnews.com/sports/tom-brady-screams-bucs-teammates-offense-sputters-vs-saints,Fox News
"A new study found that people may be at increased risk for cognitive decline if they consume more ultra-processed foods, including hamburgers and cookies.",2022,https://www.foxnews.com/health/consuming-ultra-processed-foods-could-increase-dementia-risk-study,Fox News
"A Memphis, Tennessee police officer was critically wounded during a shootout with a suspect near a gas station at 9:15pm. The suspect was pronounced dead.",2022,https://www.foxnews.com/us/tennessee-police-officer-shot-multiple-times-transported-critical-condition,Fox News
Tucker Carlson delves into the relationship between the FBI and Twitter on 'Tucker Carlson Tonight.',2022,https://www.foxnews.com/opinion/tucker-carlson-this-how-system-supposed-work,Fox News
Laura Ingraham explains why Congress should hold off on passing new spending bills until the new session begins in January in her opening monologue on 'The Ingraham Angle.',2022,https://www.foxnews.com/media/laura-ingraham-democrats-trying-ram-through-massive-spending-bills-before-new-congress,Fox News
"After a passenger confronted her, an anonymous mother turned to Reddit to ask if she was wrong for buying her young daughter a first-class ticket on a cross-country flight.",2022,https://www.foxnews.com/lifestyle/airline-outrage-passenger-tells-mom-first-class-she-shouldnt-there-child,Fox News
"The Democrats' Senate majority isn't in jeopardy, but there's plenty on the line as Sen. Raphael Warnock and GOP nominee Herschel Walker face off in the Georgia Senate runoff election",2022,https://www.foxnews.com/politics/high-stakes-herschel-walker-raphael-warnock-senate-battle-georgias-runoff-showdown,Fox News
"Members of the media from outlets that wrongly insisted Hunter Biden’s laptop was disinformation claim they don’t have egg on their face, despite Twitter owner Elon Musk’s revelations.",2022,https://www.foxnews.com/media/hunter-biden-revelations-twitter-files-prompts-media-reckoning-for-insiders-critics-sorry-episode,Fox News
"Kate Middleton, Princess of Wales, and Meghan Markle, Duchess of Sussex, are married to Princess Diana's two sons and have taken inspiration from Diana over the years.",2022,https://www.foxnews.com/entertainment/meghan-markle-kate-middleton-invoke-princess-diana-battle-spotlight,Fox News
"President Biden will not make his first official visit to the southern border when he goes to Arizona on Tuesday, which sparked criticism from conservatives and progressives.",2022,https://www.foxnews.com/politics/biden-dodges-border-arizona-visit,Fox News
"The ""Full House"" star shared gratitude for law enforcement officials during fundraiser to help the 25 injured recruits from wrong-way crash in Whittier last month.",2022,https://www.foxnews.com/entertainment/john-stamos-helps-la-sheriffs-recruits-injured-wrong-way-crash,Fox News
"Federal prosecutors recommended a life sentence for Adam Fox, the alleged ringleader of a foiled 2020 plot to kidnap Democratic Michigan Gov. Gretchen Whitmer.",2022,https://www.foxnews.com/politics/life-sentence-recommended-alleged-leader-plot-kidnap-michigan-gov-whitmer,Fox News
Rock Island Auction Company in Illinois is putting three Tiffany & Co. creations with military significance up for auction including two Civil War-era swords and a WWI naval aviator pin.,2022,https://www.foxnews.com/lifestyle/civil-war-wwi-military-items-tiffany-hit-illinois-auction-block,Fox News
"Georgia Republican governor Brian Kemp says he voted for GOP nominee Herschel Walker, a former NFL star, in the runoff election between Walker and incumbent Sen. Raphael Warnock, D-Ga.",2022,https://www.foxnews.com/politics/georgia-gov-brian-kemp-urges-voters-turn-out-herschel-walker-tuesdays-runoff-election,Fox News
"Alyssa Sturgill, 40, and Lisa Peaslee, 41, were arrested and charged with the murder of a man who was shot in Oregon’s Tillamook State Forest, authorities said.",2022,https://www.foxnews.com/us/two-women-accused-murdering-man-oregons-tillamook-state-forest-caught-nevada,Fox News
"Ukraine championed its ability to largely stop the barrage of more than 70 missiles fired at it Monday, saying it stopped 60 missile strikes.",2022,https://www.foxnews.com/world/ukraine-says-60-70-russian-missiles-struck-down-barrage-of-strikes,Fox News
Idaho police on Tuesday announced that they will be collecting and removing personal items belonging to four murdered University of Idaho students from their home.,2022,https://www.foxnews.com/us/idaho-murders-police-collect-remove-victims-personal-belongings-crime-scene,Fox News
"Filmmaker Nancy Meyers took to social media on Wednesday to deny rumors that a sequel to ""The Holiday"" is in production. The original 2006 film starred Cameron Diaz and Kate Winslet.",2022,https://www.foxnews.com/entertainment/nancy-meyers-shuts-down-rumors-the-holiday-sequel-cameron-diaz-kate-winslet-not-true,Fox News
Elon Musk and former Rolling Stone journalist Matt Taibbi were criticized for releasing the 'Twitter Files' on Friday and into the weekend; the panel on 'The Five' responded.,2022,https://www.foxnews.com/media/outrage-musk-taibbi-twitter-files-dump-revealed-media-true-bots-critics,Fox News
Olivia Wilde returned to Instagram on Sunday after a brief hiatus following her reported split from Harry Styles in November. The actress was in a bikini with her friend in the post.,2022,https://www.foxnews.com/entertainment/olivia-wilde-returns-instagram-harry-styles-split,Fox News
Rittenhouse and Sandmann asked Elon Musk to release company communications pertaining to their online treatment following the release of the 'Twitter Files.',2022,https://www.foxnews.com/media/canceled-figures-rittenhouse-sandmann-see-opportunity-musks-twitter-files-dump,Fox News
"Tiger Woods will admit it: his 13-year-old son, Charlie, has already outdrove him as the elder has told him to emulate Rory McIlroy's swing.",2022,https://www.foxnews.com/sports/tiger-woods-says-son-charlie-already-outdriving-him,Fox News
"Montreal Canadiens goaltender Carey Price tweeted his opposition to a Canadian gun-control bill over the weekend, and it caused a stir in the country.",2022,https://www.foxnews.com/sports/nhl-star-carey-prices-opposition-canadian-gun-bill-creates-stir,Fox News
"Dallas, Texas police and U.S. Marshals arrested Diavian Roberts for allegedly shooting and killing two people within a 36-hour period in the Dallas area.",2022,https://www.foxnews.com/us/dallas-police-arrest-texas-man-two-murders-hour-period,Fox News
A 45-year-old man was charged with four counts of first-degree murder after allegedly shooting and killing four workers at a marijuana farm in Oklahoma last month.,2022,https://www.foxnews.com/us/oklahoma-quadruple-homicide-suspect-charged-marijuana-farm,Fox News
"Sean Hannity discusses the corruption from Twitter and the FBI illuminated by Elon Musk on ""Hannity.""",2022,https://www.foxnews.com/media/sean-hannity-media-complicit-outright-censorship,Fox News
"Representative Dan Crenshaw introduced legislation proposing a $6,500 “deployment bonus” for agents serving along high trafficked areas of the U.S. border.",2022,https://www.foxnews.com/politics/texas-rep-dan-crenshaw-proposes-6500-bonus-border-patrol-agents,Fox News
Early voting in the Georgia Senate runoff has shattered multiple single-day in-person voting records during the early voting period that concluded on Friday.,2022,https://www.foxnews.com/politics/georgia-senate-runoff-race-shifts-toss-up-lean-democratic-eve-election-day,Fox News
"Milwaukee parents spoke out on their son's tragic death, arguing 20-year-old Danari Peer would still be alive if the district attorney was tougher on crime",2022,https://www.foxnews.com/media/milwaukee-parents-blame-liberal-district-attorneys-soft-bail-laws-sons-death-car-crash,Fox News
A lawsuit has been filed by two men suing the prosecutor's office that helped free them from prison. The men are seeking compensation from the district attorney's office.,2022,https://www.foxnews.com/us/new-orleans-ex-inmates-file-lawsuit-against-prosecutors-office-helped-free,Fox News
"Randy Moss who appeared on the ""ManningCast"" on Monday revealed he had a chance to return to the New England Patriots before he officially retired.",2022,https://www.foxnews.com/sports/randy-moss-reveals-he-had-chance-return-patriots-retirement,Fox News
Police are searching for a suspect in NYC in connection with three shootings that occurred in less than 16 hours. Two of the victims died.,2022,https://www.foxnews.com/us/manhunt-underway-suspect-3-nyc-shootings,Fox News
Brittany Aldean said she removed Balenciaga from her wardrobe in protest of the brand's 'evil' ad campaign featuring children holding bears in sexually suggestive costumes.,2022,https://www.foxnews.com/media/brittany-aldean-balenciaga-ad-campaign-pure-evil-promotes-sexualization-children-disgusting,Fox News
"The New Testament, through the apostle Paul's letters to the Romans, teaches us to turn away from what the world wants, and towards what God wants for us. Dr. Jeff Myers comments.",2022,https://www.foxnews.com/lifestyle/bible-verse-day-made-more-conforming-world,Fox News
The Florida shipwreck debris was discovered a couple of weeks ago in Daytona Beach Shores after part of the beach was washed away during Hurricane Nicole.,2022,https://www.foxnews.com/us/florida-beachs-mystery-debris-uncovered-hurricane-nicole-likely-shipwreck-from-19th-century,Fox News
"The NYPD said Tuesday a man arrested in connection with a violent shooting spree is a ""well-known"" gang member and has been arrested 12 times since 2010.",2022,https://www.foxnews.com/us/nyc-man-charged-killing-shooting-spree-well-known-gang-member-arrested-times-police-say,Fox News
"Moore County, North Carolina electric customers should see their power restored sometime on Wednesday, according to a spokesman for Duke Energy.",2022,https://www.foxnews.com/us/north-carolina-power-restored-wednesday-attack-substations,Fox News
Cleveland Browns linebacker Tony Fields II dad made a play himself on Sunday during the game with the Houston Texans.,2022,https://www.foxnews.com/sports/father-browns-tony-fields-dives-touchdown-ball-stands,Fox News
Morocco stunned the 2010 World Cup champions Spain in penalties and advanced to the quarterfinals on Tuesday. The Morocco goalkeeper made two crucial saves.,2022,https://www.foxnews.com/sports/world-cup-2022-morocco-shocks-spain-round-of-16-advance-quarterfinals-first-time,Fox News
"A murder suspect who struck his co-worker with a vehicle on a California college campus previously accused his victim on social media of racism, mistreatment, and more.",2022,https://www.foxnews.com/us/suspect-accused-fatally-striking-co-worker-car-ca-college-called-victim-social-media,Fox News
"Royal couple Prince Harry and Meghan Markle, two outspoken environmental activists, were photographed departing a private jet in New York City this week.",2022,https://www.foxnews.com/politics/eco-activists-prince-harry-meghan-pictured-leaving-private-jet-way-gala-giving-sustainability-award,Fox News
"A human rights organization, Safeguard Defenders, reported Monday that 48 additional Chinese police service stations were operating illegally on foreign soil.",2022,https://www.foxnews.com/world/shut-them-down-chinese-secret-police-stations-reportedly-found-prompting-call-consulate-closures,Fox News
"Sally Field told the hosts of ""The View"" on Tuesday that she believed the Supreme Court's decision to overturn Roe v. Wade was ""cruel"" and ""uncivilized.""",2022,https://www.foxnews.com/media/sally-field-calls-dobbs-decision-uncivilized-the-view-think-criminal,Fox News
303 Creative owner Lorie Smith spoke to Fox News Digital about her case before the Supreme Court and various threats she says she's received since filing suit in 2016.,2022,https://www.foxnews.com/media/colorado-web-designer-terrified-receiving-death-threats-supreme-court-free-speech-case,Fox News
"Moscow, Idaho, police said in an interview Tuesday they ""don't have a lot of information"" on the movements of Xana Kernodle and Ethan Chapin before they were killed.",2022,https://www.foxnews.com/us/idaho-murders-police-zeroing-timeline-two-victims-went-frat-house,Fox News
"The Fox News Lifestyle Newsletter brings you trending stories on family, travel, food, neighbors helping neighbors, pets, autos, military veterans, heroes, faith and American values.",2022,https://www.foxnews.com/lifestyle/mom-says-flight-passenger-confronted-having-toddler-first-class,Fox News
Anthony Fauci couldn't recall the studies that said hydroxychloroquine is an ineffective COVID-19 treatment or that a major medical journal retracted its study on the subject.,2022,https://www.foxnews.com/politics/fauci-doesnt-remember-that-study-based-hydroxychloroquine-covid-treatment-claims-retracted,Fox News
"The parents of Gabby Petito added attorney Steven Bertolino to a civil lawsuit against Brian Laundrie's parents on Tuesday, alleging that he also knew Brian killed Gabby.",2022,https://www.foxnews.com/us/gabby-petitos-parents-add-attorney-steven-bertolino-lawsuit-brian-laundries-family,Fox News
A Texas woman reportedly left buckets of human waste outside a police station and refused to pick them up.,2022,https://www.foxnews.com/us/texas-hazmat-suit-leaving-buckets-human-waste-police-station,Fox News
"MLB's top free agent, Aaron Judge, admitted in a recent interview that he was ""a little upset"" with the Yankees for leaking details of their failed contract talks before 2022 season.",2022,https://www.foxnews.com/sports/aaron-judge-admits-being-upset-yankees-failed-contract-details-leaked-2022-season,Fox News
The Department of Justice has announced it will be monitoring polling places during the Georgia senate election on Tuesday to ensure voting rights are respected.,2022,https://www.foxnews.com/us/doj-monitoring-georgia-polls-voting-rights-compliance-election-underway,Fox News
Tampa Bay Buccaneers quarterback Tom Brady sent a sweet message to his daughter and wished her a happy birthday after defeating the New Orleans Saints.,2022,https://www.foxnews.com/sports/tom-brady-wishes-daughter-happy-birthday-sweet-moment-win-saints-daddy-loves-you,Fox News
Need another reason Tampa Bay Buccaneers' Tom Brady is the greatest of all-time? Look no further than his game-winning drive against the Saints on Monday night,2022,https://www.foxnews.com/sports/bucs-tom-brady-orchestrates-miraculous-comeback-win-to-stun-saints,Fox News
