sentence,pub_year,news_link,outlet
"A second sports journalist has died in Qatar while covering the 2022 FIFA World Cup, according to reports.",2022,https://www.breitbart.com/sports/2022/12/12/second-reporter-dies-while-covering-the-world-cup-in-qatar/,Breitbart News
New Zealand's Prime Minister Jacinda Ardern said on Tuesday that six members of parliament will retire ahead of the 2023 election including Associate Foreign Minister Aupito William Sio.,2022,https://www.reuters.com/world/asia-pacific/six-new-zealand-parliamentarians-retire-2023-election-2022-12-12/,Reuters
"The European Union is ready to reinforce its EULEX mission, tasked with patrolling northern Kosovo, in response to the latest tensions in the region, the bloc's foreign policy chief said on Monday.",2022,https://www.reuters.com/world/europe/eu-prepared-send-reinforcements-mission-kosovo-2022-12-12/,Reuters
Iran executed a second prisoner who was detained during protests against the country's theocracy. The hanging came quickly after his alleged stabbings.,2022,https://www.foxnews.com/world/iran-executed-second-detainee-over-anti-theocracy-protest,Fox News
"People queued on Monday outside fever clinics at China's hospitals to check if they had COVID-19, a new sign of the rapid spread of symptoms after authorities began dismantling stringent measures against the disease.",2022,https://www.reuters.com/world/china/please-protect-yourself-china-wrestles-with-covid-surge-2022-12-12/,Reuters
"Millions of Catholic pilgrims gathered at a basilica in Mexico City to mark the annual Virgin of Guadalupe feast day, with crowds camping overnight on Sunday after walking for days to reach the shrine in a centuries-old act of religious devotion.",2022,https://www.reuters.com/world/americas/mexicos-guadalupe-pilgrimage-draws-millions-devotees-2022-12-12/,Reuters
An American college student has been reported missing while studying abroad in France. He last made contact with his family on Whatsapp on November 27.,2022,https://www.foxnews.com/world/ken-deland-missing-american-college-student-disappears-france-studying-abroad,Fox News
"Malaysia's state energy firm Petronas said on Monday it would work with JX Nippon Oil & Gas Exploration Corp on a joint proposal to monetise gas potential in the Bujang, Inas, Guling, Sepat and Tujoh (BIGST) fields located off the shores of peninsular Malaysi…",2022,https://www.reuters.com/business/energy/petronas-jx-nippon-collaborate-proposal-develop-gas-fields-off-malaysia-2022-12-12/,Reuters
"FTX CEO John Ray will tell lawmakers on Tuesday that the bankrupt cryptocurrency exchange had ""unacceptable management practices"" including the commingling of assets and lack of internal controls, according to prepared remarks published by the U.S. House Fina…",2022,https://www.reuters.com/technology/ftx-ceo-detail-unacceptable-management-practices-congressional-testimony-2022-12-12/,Reuters
"The watchdog group StopAntisemitism.org has crowned the rapper Kanye West ""Antisemite of the Year"" due to his string of public antisemitic rants, conspiratorial attitudes toward Jewish people, and his praise of Nazi dictator Adolph Hitler.",2022,https://www.breitbart.com/entertainment/2022/12/12/watchdog-group-crowns-kanye-west-antisemite-of-the-year/,Breitbart News
"More than 11,000 children have been killed or wounded in the conflict in Yemen since 2015, the U.N. Children's Emergency Fund (UNICEF) said on Monday, a week after it launched a multi-billion global funding drive.",2022,https://www.reuters.com/world/middle-east/more-than-11000-children-killed-or-wounded-yemen-since-2015-unicef-2022-12-12/,Reuters
"Two gunman opened fire on police killing two officers and a bystander in Queensland, Australia. The two gunman remain on the run and have been tracking police.",2022,https://www.foxnews.com/world/2-australian-police-officers-bystander-fatally-shot-queensland-ambush,Fox News
"The father of Ken DeLand, an upstate New York college student missing in France, warned other parents to be wary of privacy rules before their adult kids study abroad.",2022,https://www.foxnews.com/world/ken-deland-dad-of-american-college-student-missing-in-france-warns-other-parents-over-studying-abroad,Fox News
"The Ministry of Defence is gambling its reputation somewhat by predicting Russia is ""unlikely"" to make significant gains in the coming months",2022,https://www.breitbart.com/europe/2022/12/12/highly-unlikely-russia-can-retake-lost-territory-probably-no-significant-gains-months-uk-intel/,Breitbart News
Woke country star Maren Morris has come out swinging in defense of Prince Harry and Meghan Markle as audiences savage their docuseries.,2022,https://www.breitbart.com/entertainment/2022/12/12/woke-country-star-maren-morris-defends-prince-harry-meghan-markle-docuseries/,Breitbart News
"Heavy snowfall blanketed parts of Britain on Monday, disrupting airports, train networks and roads in London, while two coal plants have been put on standby in case of a power crunch over winter.",2022,https://www.reuters.com/world/uk/heavy-snow-britain-disrupts-travel-national-grid-readies-two-coal-plants-2022-12-12/,Reuters
"Turkish President Recep Tayyip Erdogan has recently indicated a willingness to improve relations with Syria, which possibly could be a result of Russian encouragement.",2022,https://www.foxnews.com/world/turkeys-pending-syria-invasion-motivated-politics-security-concerns-experts-say,Fox News
"An Israeli police dispatcher who took a call from a young woman who wanted to order a pizza quickly realized the caller was in danger of domestic violence, and was able to send officers to help her within minutes, Israel Police said.",2022,https://www.breitbart.com/middle-east/2022/12/12/israeli-woman-fake-orders-pizza-from-police-while-being-assaulted/,Breitbart News
Three young boys who fell through ice covering a lake in central England have died and a fourth remains hospitalized.,2022,https://www.breitbart.com/europe/2022/12/12/three-children-die-after-falling-through-ice-into-lake-in-uk/,Breitbart News
Copper's future in the energy transition may be bright but it's the problematic here and now that is weighing on fund managers' minds.,2022,https://www.reuters.com/business/energy/fund-managers-still-see-no-reason-be-bullish-copper-andy-home-2022-12-12/,Reuters
"Global public and private debt saw its biggest drop in 70 years in 2021 after reaching record highs because of the impacts of COVID-19, but overall remained well above pre-pandemic levels, the International Monetary Fund said on Monday.",2022,https://www.reuters.com/markets/imf-says-global-debt-well-above-pre-pandemic-levels-despite-steep-2021-drop-2022-12-12/,Reuters
"Farage has slammed to green-obsessed ""idiots"" running the country as two coal-fired reserve power plants are warmed up in case of shortages.",2022,https://www.breitbart.com/europe/2022/12/12/were-led-by-idiots-farage-slams-green-agenda-as-reserve-coal-power-stations-fired-up/,Breitbart News
"The United States on Monday unsealed criminal charges against a third alleged conspirator in the 1988 bombing of Pan Am Flight 103 over Lockerbie, Scotland that killed 270 people.",2022,https://www.reuters.com/world/us/us-charges-libyan-man-1988-pam-am-flight-103-bombing-2020-12-21/,Reuters
Greek Foreign Minister Niko Dendias lashed out at Turkey threatening to bomb Athens. The relationship between the two NATO nations has been strained for a long time.,2022,https://www.foxnews.com/world/greek-government-slams-turkey-threatening-athens,Fox News
The National Grid has announced it is firing up two coal-fired reserve power plants as a winter snap leaves Britain facing blackouts.,2022,https://www.breitbart.com/europe/2022/12/12/green-fail-uk-grid-fires-up-coal-power-stations-amid-energy-crisis/,Breitbart News
'The Five' co-hosts discuss the fifth installment of the 'Twitter files' and the GOP calling for Elon Musk to testify at hearings about the social media company's role in censoring the Hunter Biden laptop story.,2022,https://www.foxnews.com/video/6317093344112,Fox News
"'The Five' co-hosts discuss Rep. Alexandria Ocasio-Cortez, D-N.Y., calling out Arizona Sen. Kyrsten Sinema for leaving the Democratic Party and registering as an Independent.",2022,https://www.foxnews.com/video/6317095278112,Fox News
"Nearly two in five Americans across the religious spectrum said they believe they are living in the end times, according to a new study from Pew Research about climate change.",2022,https://www.foxnews.com/us/2-5-americans-nearly-half-christians-believe-we-are-living-end-times-poll,Fox News
Department of State spokesperson Ned Price confirmed that soccer journalist Grant Wahl's body has been returned to the U.S. He died while covering the World Cup.,2022,https://www.foxnews.com/sports/grant-wahls-body-returned-to-us-tragic-death-world-cup,Fox News
The 'Outnumbered' reacts to flight data revealing Biden Transportation Secretary Pete Buttigieg used taxpayer dollars for private jet travel despite previous climate change concerns.,2022,https://www.foxnews.com/media/pete-buttigieg-ripped-for-using-taxpayer-funded-private-jets-amid-calls-to-cut-emissions-walk-the-walk-man,Fox News
Tom Brady's frustrations reached a boiling point on Sunday after the Tampa Bay Buccaneers 35-7 loss to the San Francisco 49ers.,2022,https://www.foxnews.com/sports/tom-brady-reportedly-ends-disastrous-night-san-francisco-shower-f-that-im-going-home,Fox News
"Bloomberg Television’s Taylor Riggs Joins FBN As Co-Anchor of “The Big Money Show” Alongside Brian Brenberg and Jackie DeAngelis FBN’s Dagen McDowell and Sean Duffy to Co-Host “The Bottom Line” NEW YORK – December 12, 2022 – FOX Business Network (FBN) will de…",2022,https://press.foxnews.com/2022/12/fox-business-network-to-launch-new-programming-in-january,Fox News
"Video obtained by Fox News shows the moment a migrant caravan of more than 1,000 people crossed into El Paso, Texas, where the Border Patrol currently has over 5,000 people in custody.",2022,https://www.foxnews.com/us/migrant-caravan-of-more-than-1000-crosses-illegally-into-el-paso-texas-video-shows,Fox News
Billionaire Twitter CEO Elon Musk was booed by an audience on Sunday after comedian Dave Chappelle brought him out on stage during a show in San Francisco.,2022,https://www.foxnews.com/media/elon-musk-booed-dave-chappelle-show-san-francisco,Fox News
"Gary Gensler, the head of the powerful Securities and Exchange Commission, has repeatedly hidden key meetings from public view, raising questions about his agency's transparency.",2022,https://www.foxnews.com/politics/biden-official-hid-info-meetings-george-soros-hillary-clinton-nancy-pelosi-public,Fox News
"Victoria Cummock, the widow of a passenger aboard Pan Am flight 103, reacts to the 1988 Lockerbie bombing suspect being taken into U.S. custody on 'Your World.'",2022,https://www.foxnews.com/video/6317097075112,Fox News
NSC Coordinator for Strategic Communications John Kirby speaks on how the Biden administration is currently working to bring Paul Whelan back to America on 'Your World.',2022,https://www.foxnews.com/video/6317096577112,Fox News
"As a ""Fostering the Future"" initiative, former President Trump and first lady Melania Trump spread Christmas cheer to foster families with a special holiday celebration.",2022,https://www.foxnews.com/media/melania-trump-shares-christmas-magic-message-hope-compassion-foster-care-holiday-celebration,Fox News
The United States will commit $55 billion to Africa over the next three years as President Joe Biden prepares to host the U.S.-Africa summit this week and discuss 2023 elections and democracy in the continent with a small group of leaders.,2022,https://www.reuters.com/world/africa/us-says-commit-55-bln-africa-ahead-summit-2022-12-12/,Reuters
"Croatia and Morocco are the surprise guests in the World Cup's final four but, as the Croatians discovered in 2018 and many other long-shot semi-finalists have before them, the two remaining steps to become world champions can be the steepest.",2022,https://www.reuters.com/lifestyle/sports/can-morocco-or-croatia-shatter-world-cups-glass-ceiling-2022-12-12/,Reuters
"Pakistan will likely secure a multibillion-dollar financial support package from long-time ally Saudi Arabia this month, two sources said, as the country awaits the ninth review of a $7 billion IMF bailout package.",2022,https://www.reuters.com/world/pakistan-expects-multi-billion-dollar-support-saudi-arabia-sources-2022-12-12/,Reuters
"Russian commercial bank Uralsib said on Monday it had completed the acquisition of a portfolio of consumer loans from Citigroup Inc's <a href=""https://www.reuters.com/companies/C.N"" target=""_blank"">(C.N)</a> Russian unit, as the major U.S. lender reduces its …",2022,https://www.reuters.com/markets/uralsib-completes-purchase-citis-russian-consumer-loan-portfolio-2022-12-12/,Reuters
Most big banks and investment managers expect the cryptocurrency market to pick up in 2023 after a brutal year that saw bitcoin sink around 75% from its all-time high in November last year.,2022,https://www.reuters.com/markets/currencies/crypto-winter-end-sight-ethereum-looks-shake-chills-analysts-2022-12-12/,Reuters
"China's new rules for content providers that alter facial and voice data will take effect from Jan. 10, its cyberspace regulator said, as it looks to more tightly scrutinize so-called ""deepfake"" technology and services.",2022,https://www.reuters.com/technology/chinas-rules-deepfakes-take-effect-jan-10-2022-12-12/,Reuters
"Bulgaria's prime minister-designate Nikolay Gabrovski, from the centre-right GERB party, proposed forming a technocrat government to lead the Balkan country out of political stalemate on Monday, as he faced a tough task to build the necessary support in parli…",2022,https://www.reuters.com/world/europe/bulgarias-centre-right-gerb-party-proposes-technocrat-govt-2022-12-12/,Reuters
A crackdown by U.S. drug wholesalers in response to the opioid crisis is preventing some pharmacists from dispensing a combination of stimulants and sedatives routinely prescribed by psychiatrists to help patients manage conditions like anxiety and ADHD.,2022,https://www.reuters.com/business/healthcare-pharmaceuticals/us-opioid-crackdown-hits-some-patients-access-psychiatric-drugs-2022-12-12/,Reuters
"After playing catch-up with inflation through the past year in a policy shift made urgent by relentlessly rising prices, the U.S. Federal Reserve now faces a more subtle judgment about whether the economy is strong enough to motor through even higher interest…",2022,https://www.reuters.com/markets/us/too-good-be-bad-too-risky-be-good-fed-managing-unloved-economy-2022-12-12/,Reuters
"The U.S. Congress faces a Friday deadline to fund the federal government, as Democrats and Republicans bicker over the details of an expected roughly $1.5 trillion funding bill in the final weeks that Democrats control both the House and Senate.",2022,https://www.reuters.com/world/us/us-congress-creeps-toward-deadline-pass-15-trillion-funding-bill-2022-12-12/,Reuters
"The U.S. Federal Reserve's likely shift to a smaller interest rate increase this week could offer some respite to bond investors hit hard by a string of super-sized hikes, though questions remain on how much damage the Fed is ready to inflict on the economy.",2022,https://www.reuters.com/markets/bond-investors-expect-smaller-fed-rate-hike-brace-inflation-shocks-2022-12-12/,Reuters
"A Libyan intelligence operative suspected of making the bomb that killed 270 people on Pan Am flight 103 over Lockerbie, Scotland in 1988 will appear in a federal court in Washington, D.C. on Monday, the U.S. Justice Department said.",2022,https://www.reuters.com/world/lockerbie-bombing-suspect-appear-us-court-2022-12-12/,Reuters
"The Group of Seven (G7) economic powers said on Monday they would continue to work together to bolster Ukraine's military capabilities, with an immediate focus on air defence systems, according to a leaders' statement released by Britain.",2022,https://www.reuters.com/world/europe/g7-focus-boosting-ukraines-air-defence-leaders-statement-2022-12-12/,Reuters
"Here is a timeline of main events since the 1988 bombing of Pan Am flight 103 over Lockerbie, Scotland, which was back in the news this week with the <a href=""/world/lockerbie-bombing-suspect-appear-us-court-2022-12-12/"">capture</a> of a Libyan intelligence o…",2022,https://www.reuters.com/world/lockerbie-bombing-who-what-when-2022-12-12/,Reuters
"Ethiopia's government will investigate the reported deaths of 27 of its citizens found in a farming area on the outskirts of Zambia's capital Lusaka, Ethiopia's state news agency said on Monday.",2022,https://www.reuters.com/world/africa/ethiopia-investigate-deaths-27-migrants-zambia-state-news-agency-2022-12-12/,Reuters
"The U.S. Department of Energy will announce on Tuesday that scientists at a national lab have made a breakthrough on fusion energy, the process that powers the sun and stars that one day could provide a cheap source of electricity, two sources with knowledge …",2022,https://www.reuters.com/business/energy/us-announce-scientific-breakthrough-fusion-energy-sources-2022-12-12/,Reuters
"British defence minister Ben Wallace said on Monday he would be ""open minded"" about supplying Ukraine with longer-range weapons systems if Russia carried on targeting civilian areas.",2022,https://www.reuters.com/world/europe/uk-minister-is-open-minded-over-sending-longer-range-weapons-ukraine-2022-12-12/,Reuters
"European Union foreign ministers agreed in principle on Monday to add about 200 Russian people and groups to a sanctions list, even if a <a href=""/markets/europe/eu-commission-proposes-ninth-package-sanctions-against-russia-2022-12-07/"">whole ninth package of…",2022,https://www.reuters.com/world/europe/eu-agrees-adding-names-russia-sanctions-list-no-deal-yet-sanctions-package-2022-12-12/,Reuters
A makeshift boat loaded with Cubans drifted just off Havana's seaside drive on Monday before those aboard were rescued by the Cuban Coast Guard as hundreds of spectators looked on.,2022,https://www.reuters.com/world/americas/cuban-coast-guard-rescues-would-be-migrants-adrift-off-havana-2022-12-12/,Reuters
"U.S. President Joe Biden is establishing an inter-agency to coordinate efforts to counter antisemitism, Islamophobia and related forms of bias and discrimination, the White House said on Monday.",2022,https://www.reuters.com/world/us/us-form-inter-agency-group-counter-anti-semitism-islamophobia-2022-12-12/,Reuters
"Morgan, Lewis & Bockius told a New York state judge on Friday that ex-client Prospect Capital Corp was improperly trying to blame the law firm for its own misfortune, asking the court to dismiss the investment company's $12 million legal malpractice lawsuit.",2022,https://www.reuters.com/legal/legalindustry/morgan-lewis-asks-ny-court-toss-12-million-legal-malpractice-case-2022-12-12/,Reuters
German Chancellor Olaf Scholz said on Monday that economic cooperation between Germany and Russia could be possible again if the Kremlin ended its war in Ukraine.,2022,https://www.reuters.com/world/europe/russia-could-resume-business-with-germany-if-it-ends-ukraine-war-scholz-2022-12-12/,Reuters
"Senior U.S. officials met virtually on Monday with Elizabeth Whelan, the sister of Paul Whelan, an American imprisoned in Russia, and assured her of President Joe Biden's commitment to gaining her brother's release, the White House said.",2022,https://www.reuters.com/world/us/us-officials-met-with-sister-paul-whelan-american-detained-russia-2022-12-12/,Reuters
Ukraine's economy is on track to take a $700 billion hit following 10 months of war with Russia by the year's end.,2022,https://www.foxnews.com/world/ukraine-economy-take-700b-hit-war-russia,Fox News
"An old blueprint of the Moscow, Idaho, home where four college students were mysteriously murdered on Nov. 13 shows the second and third floor plans of the residence.",2022,https://www.foxnews.com/us/idaho-murders-floor-plan-shows-house-where-4-students-were-mysteriously-killed,Fox News
Red Farmer is looking to get back on the track as he is in the hospital battling double pneumonia. The NASCAR great is still driving at the age of 90.,2022,https://www.foxnews.com/sports/nascar-legend-red-farmer-90-itching-back-track-battles-double-pneumonia,Fox News
Fox News footage shows the continued release of migrants at the southern border as authorities face a looming end to the Title 42 expulsion authority just days away.,2022,https://www.foxnews.com/politics/fox-news-footage-mass-release-migrants-us-numbers-hit-500000-fy-23,Fox News
"Emily Blunt clarified her comments made on a podcast about her ""dear friend"" Tom Cruise. The actress wasn't ""offended"" by vulgar advice Cruise gave on set of ""The Edge of Tomorrow.""",2022,https://www.foxnews.com/entertainment/emily-blunt-tom-cruises-vulgar-advice-didnt-offend-her-ludicrous,Fox News
The family of composer Angelo Badalamenti confirmed that the Grammy award-winning composer died Sunday of natural causes. He was 85 years old.,2022,https://www.foxnews.com/entertainment/angelo-badalamenti-twin-peaks-and-blue-velvet-composer-dead-85,Fox News
"Retired United States Navy SEAL Chris Beck, who had been known as Kristin Beck, announced their detransition and spoke out to Fox News' Tucker Carlson.",2022,https://www.foxnews.com/media/detransitioning-navy-seal-speaks-against-children-rushing-treatment,Fox News
A video of an American bride greeting her family before her wedding ceremony in India has gone viral with 12 million views on Instagram. Another video with her parents has gotten 5 million views.,2022,https://www.foxnews.com/lifestyle/american-bride-viral-familys-surreal-reaction-indian-wedding-attire,Fox News
New England Patriots wide receiver Nelson Agholor had to yell and scream to get play to stop after DeVante Parker appeared to suffer an injury.,2022,https://www.foxnews.com/sports/patriots-nelson-agholor-pleads-play-stop-devante-parker-looked-dazed-catch,Fox News
HIGHLY ADDICTIVE – The two potent drugs driving America's homeless crisis,2022,https://www.foxnews.com/us/two-potent-drugs-driving-america-homeless-crisis,Fox News
"Mississippi State announced Tuesday morning longtime college football coach Mike Leach has died after he battled a ""personal health issue."" He was 61.",2022,https://www.foxnews.com/sports/mike-leach-longtime-college-football-coach-dead,Fox News
Russian President Vladimir Putin canceled his annual year-end press conference for the first time in a decade on Tuesday. Observers say Putin fears growing anti-war sentiment.,2022,https://www.foxnews.com/politics/vladimir-putin-cancels-annual-press-conference-russia-stalls-ukraine,Fox News
One person died in a multi-vehicle collision in New Hampshire involving a tractor-trailer on Route 16. Another person was injured in the crash,2022,https://www.foxnews.com/us/man-dies-new-hampshire-multi-vehicle-collision-involving-tractor-trailor,Fox News
"Kurt Knutsson the CyberGuy explains why two-factor authentication will improve security on all your devices, and shows you how to enable it on your devices.",2022,https://www.foxnews.com/tech/what-two-factor-authentication-should-enable-it,Fox News
Social media users reacted to the news that Sam Bankman-Fried had been arrested in the Bahamas ahead of testifying in front of a U.S. House committee.,2022,https://www.foxnews.com/media/sam-bankman-frieds-arrest-celebrated-mocked-twitter-users-bad-news-democrats,Fox News
"A storm system is forecast to impact millions across the country, bringing severe weather including blizzard conditions and heavy rainfall through the week.",2022,https://www.foxnews.com/us/severe-weather-us-heavy-rain-blizzard-conditions,Fox News
A Los Angeles man was sentenced to 10 years in federal prison for unlocking hundreds of thousands of cellphones and stealing $25 million from wireless carriers.,2022,https://www.foxnews.com/us/ca-man-sentenced-10-years-illegally-unlocking-thousands-phones,Fox News
A 54-year-old man fell 30 feet to his death earlier in December while he was canyoneering alone in California's Death Valley National Park's Mosaic Canyon.,2022,https://www.foxnews.com/us/man-falls-death-national-park-rappelling-mistake,Fox News
"James Cameron directed the 2009 ""Avatar"" movie and the sequel, ""Avatar: The Way of Water."" The director said that the script for the fourth movie did not receive any notes.",2022,https://www.foxnews.com/entertainment/james-cameron-avatar-4-script-first-franchise-notes-studio-executives,Fox News
"Cambridge Dictionary is under fire for altering the definition of ""man"" and ""woman"" to encompass transgender people. Critics argue it erodes truth and elevates far-feft social values.",2022,https://www.foxnews.com/media/cambridge-dictionary-changes-definition-man-woman-1984-supposed-manual,Fox News
Arizona Cardinals quarterback Kyler Murray suffered a non-contact knee injury during Monday's game against the New England Patriots and the team reportedly fears he tore his ACL.,2022,https://www.foxnews.com/sports/kyler-murrays-knee-injury-doesnt-look-good-cardinals-reportedly-fear-torn-acl,Fox News
Argentina and Croatia are both hungry to get back to the World Cup final and they will meet in the semifinal on Tuesday in one of the biggest matchups yet.,2022,https://www.foxnews.com/sports/world-cup-2022-what-to-know-about-the-argentina-croatia-semifinal,Fox News
Peyton Manning shared some interesting Bill Belichick stories on Monday night as the legendary quarterback talked about the Pro Bowl.,2022,https://www.foxnews.com/sports/peyton-manning-shares-how-bill-belichick-stuck-art-modell-why-chose-long-snapper-pro-bowl,Fox News
